{
  "$schema": "./argv-grammar.schema.json",
  "version": 1,
  "rules": [
    "global_flag_before_command",
    "version_alone",
    "help_after_command",
    "exact_spelling",
    "abbreviation",
    "short_cluster",
    "equals_value_with_spaces",
    "negative_number_after_equals",
    "double_dash_ends_options",
    "repeated_option",
    "repeatable_option_keeps_order",
    "needs_value",
    "needs_value_before_double_dash",
    "needs_value_before_option",
    "value_on_flag",
    "extra_positional",
    "double_dash_alone",
    "dash_token_not_option",
    "unknown_command"
  ],
  "globals": [
    {
      "names": [
        "--json"
      ],
      "kind": "flag",
      "repeatable": false
    },
    {
      "names": [
        "--debug"
      ],
      "kind": "flag",
      "repeatable": false
    },
    {
      "names": [
        "--quiet"
      ],
      "kind": "flag",
      "repeatable": false
    }
  ],
  "top": {
    "help": [
      "-h",
      "--help"
    ],
    "version": [
      "-V",
      "--version"
    ],
    "keys": {
      "unrecognized": "input.unknown_command"
    },
    "fixes": {
      "flag": "run `agentce --help` for the commands and global flags agentce takes.",
      "command": "run `agentce --help` for the commands agentce takes."
    }
  },
  "commands": {
    "validate": {
      "options": [
        {
          "names": [
            "--bundle"
          ],
          "kind": "value",
          "repeatable": false,
          "needs_value_key": "input.bundle_missing"
        },
        {
          "names": [
            "--out"
          ],
          "kind": "value",
          "repeatable": false
        }
      ],
      "positionals": {
        "min": 0,
        "max": 0
      },
      "keys": {
        "unrecognized": "input.validate_unrecognized_flag",
        "needs_value": "input.validate_unrecognized_flag"
      },
      "fixes": {
        "flag": "run `agentce validate --help` for the flags validate takes, or drop the flag.",
        "extra": "pass the bundle with its flag: `agentce validate --bundle <dir>`."
      },
      "implemented_in": [
        "python",
        "typescript",
        "java"
      ]
    },
    "verify": {
      "options": [
        {
          "names": [
            "--bundle"
          ],
          "kind": "value",
          "repeatable": false
        },
        {
          "names": [
            "--catalog"
          ],
          "kind": "value",
          "repeatable": false
        },
        {
          "names": [
            "--release"
          ],
          "kind": "value",
          "repeatable": false
        },
        {
          "names": [
            "--report"
          ],
          "kind": "value",
          "repeatable": false
        },
        {
          "names": [
            "--signer-trust-root"
          ],
          "kind": "value",
          "repeatable": false
        },
        {
          "names": [
            "--expect-keyid"
          ],
          "kind": "value",
          "repeatable": false
        }
      ],
      "positionals": {
        "min": 0,
        "max": 0
      },
      "keys": {
        "unrecognized": "input.verify_unrecognized_flag",
        "needs_value": "input.verify_unrecognized_flag"
      },
      "fixes": {
        "flag": "pass --bundle, --catalog, --release, or --report (with --signer-trust-root or --expect-keyid for --report), or drop the flag.",
        "extra": "pass the target with its flag, e.g. `agentce verify --bundle <dir>`."
      },
      "implemented_in": [
        "python",
        "typescript",
        "java"
      ]
    },
    "assess": {
      "options": [
        {
          "names": [
            "--bundle"
          ],
          "kind": "value",
          "repeatable": false
        },
        {
          "names": [
            "--catalog"
          ],
          "kind": "value",
          "repeatable": false
        },
        {
          "names": [
            "--profile"
          ],
          "kind": "value",
          "repeatable": false
        },
        {
          "names": [
            "--deviations"
          ],
          "kind": "value",
          "repeatable": false,
          "value_hint": "<file>"
        },
        {
          "names": [
            "--domain"
          ],
          "kind": "value",
          "repeatable": false
        },
        {
          "names": [
            "--catalog-dir"
          ],
          "kind": "value",
          "repeatable": true
        },
        {
          "names": [
            "--trust-root"
          ],
          "kind": "value",
          "repeatable": false
        },
        {
          "names": [
            "--allow-unverified-catalog"
          ],
          "kind": "flag",
          "repeatable": false
        },
        {
          "names": [
            "--package-for-sharing"
          ],
          "kind": "flag",
          "repeatable": false
        },
        {
          "names": [
            "--out"
          ],
          "kind": "value",
          "repeatable": false
        },
        {
          "names": [
            "--state"
          ],
          "kind": "value",
          "repeatable": false
        },
        {
          "names": [
            "--report-language"
          ],
          "kind": "value",
          "repeatable": false
        },
        {
          "names": [
            "--emit"
          ],
          "kind": "value",
          "repeatable": false,
          "value_hint": "<formats>"
        },
        {
          "names": [
            "--for"
          ],
          "kind": "value",
          "repeatable": false,
          "value_hint": "<preset>"
        },
        {
          "names": [
            "--fail-on"
          ],
          "kind": "value",
          "repeatable": false,
          "value_hint": "<expression>"
        }
      ],
      "positionals": {
        "min": 0,
        "max": 1
      },
      "keys": {
        "unrecognized": "input.assess_unrecognized_flag",
        "needs_value": "input.assess_flag_needs_value"
      },
      "fixes": {
        "flag": "run `agentce assess --help` for the flags assess takes, or drop the flag.",
        "extra": "pass at most one records folder: `agentce assess <folder>`."
      },
      "implemented_in": [
        "python",
        "typescript",
        "java"
      ]
    },
    "report": {
      "options": [
        {
          "names": [
            "--from"
          ],
          "kind": "value",
          "repeatable": false,
          "needs_value_key": "input.from_missing"
        },
        {
          "names": [
            "--format"
          ],
          "kind": "value",
          "repeatable": false,
          "choices": [
            "md",
            "html",
            "oscal",
            "sarif",
            "public",
            "pack"
          ]
        },
        {
          "names": [
            "--role"
          ],
          "kind": "value",
          "repeatable": false,
          "choices": [
            "provider",
            "deployer"
          ]
        },
        {
          "names": [
            "--catalog"
          ],
          "kind": "value",
          "repeatable": false
        },
        {
          "names": [
            "--language"
          ],
          "kind": "value",
          "repeatable": false
        },
        {
          "names": [
            "--out"
          ],
          "kind": "value",
          "repeatable": false
        },
        {
          "names": [
            "--validate"
          ],
          "kind": "value",
          "repeatable": false,
          "needs_value_key": "input.validate_missing"
        }
      ],
      "positionals": {
        "min": 0,
        "max": 0
      },
      "keys": {
        "unrecognized": "input.report_unrecognized_flag",
        "needs_value": "input.report_unrecognized_flag"
      },
      "fixes": {
        "flag": "run `agentce report --help` for the flags report takes, or drop the flag.",
        "extra": "pass the input with its flag: `agentce report --from <file>` or `--validate <dir>`."
      },
      "implemented_in": [
        "python",
        "typescript",
        "java"
      ]
    },
    "collect": {
      "options": [
        {
          "names": [
            "--config"
          ],
          "kind": "value",
          "repeatable": false
        },
        {
          "names": [
            "--out"
          ],
          "kind": "value",
          "repeatable": false
        },
        {
          "names": [
            "--dry-run"
          ],
          "kind": "flag",
          "repeatable": false
        },
        {
          "names": [
            "--adapters-root"
          ],
          "kind": "value",
          "repeatable": false
        }
      ],
      "positionals": {
        "min": 0,
        "max": 0
      },
      "keys": {
        "unrecognized": "input.collect_unrecognized_flag",
        "needs_value": "input.collect_unrecognized_flag"
      },
      "fixes": {
        "flag": "run `agentce collect --help` for the flags collect takes, or drop the flag.",
        "extra": "pass the config with its flag: `agentce collect --config <file>`."
      },
      "implemented_in": [
        "python"
      ]
    },
    "ingest": {
      "options": [
        {
          "names": [
            "--in"
          ],
          "kind": "value",
          "repeatable": false
        },
        {
          "names": [
            "--out"
          ],
          "kind": "value",
          "repeatable": false
        },
        {
          "names": [
            "--adapter"
          ],
          "kind": "value",
          "repeatable": false
        },
        {
          "names": [
            "--adapters-root"
          ],
          "kind": "value",
          "repeatable": false
        },
        {
          "names": [
            "--subject"
          ],
          "kind": "value",
          "repeatable": false